{
  "listener": { "label": "demo chair", "origin_note": "center of head, seated" },
  "spots": [
    { "spot": 1, "label": "far left",     "position": [-0.42, 0.42, 0.0] },
    { "spot": 2, "label": "center left",  "position": [-0.16, 0.58, 0.0] },
    { "spot": 3, "label": "center right", "position": [ 0.16, 0.58, 0.0] },
    { "spot": 4, "label": "far right",    "position": [ 0.42, 0.42, 0.0] }
  ],
  "areas": [
    { "area": "kitchen_counter", "label": "the counter", "position": [0, 0.6, 0] },
    { "area": "cupboard", "label": "the cupboard", "position": [0, 1.5, 1.0] },
    { "area": "drawer", "label": "the drawer", "position": [1.5, 0, 0.4] },
    { "area": "bag", "label": "the bag", "position": [-1.5, 0, 0.5] },
    { "area": "box", "label": "the box", "position": [0, -1.5, 0.8] }
  ],
  "receivers": [ { "receiver": "hub", "label": "the counter", "position": [0, 0.6, 0] } ]
}
